{
  "$schema": "https://json-schema.org/draft/2020-12/schema",
  "$id": "https://civil-aviation-doc-audit.local/schemas/registry-schema.json",
  "title": "规则注册表 registry.json",
  "description": "校验 rules/registry.json 全量注册表结构。参考 spec.md 第 5.3 节。",
  "type": "object",
  "required": [
    "schema_version",
    "updated_at",
    "total_rules",
    "by_level",
    "by_scope",
    "by_status",
    "rules"
  ],
  "properties": {
    "schema_version": {
      "type": "string",
      "description": "注册表 schema 版本号"
    },
    "updated_at": {
      "type": "string",
      "pattern": "^\\d{4}-\\d{2}-\\d{2}(T\\d{2}:\\d{2}:\\d{2})?(Z|[+-]\\d{2}:\\d{2})?$",
      "description": "注册表更新时间，ISO 8601"
    },
    "total_rules": {
      "type": "integer",
      "minimum": 0,
      "description": "规则总数"
    },
    "by_level": {
      "type": "object",
      "required": ["L1-IRON", "L2-LOGIC", "L3-BUSINESS"],
      "properties": {
        "L1-IRON": {"type": "integer", "minimum": 0},
        "L2-LOGIC": {"type": "integer", "minimum": 0},
        "L3-BUSINESS": {"type": "integer", "minimum": 0}
      },
      "additionalProperties": false
    },
    "by_scope": {
      "type": "object",
      "required": ["SINGLE_DOC", "CROSS_DOC", "CROSS_UNIT"],
      "properties": {
        "SINGLE_DOC": {"type": "integer", "minimum": 0},
        "CROSS_DOC": {"type": "integer", "minimum": 0},
        "CROSS_UNIT": {"type": "integer", "minimum": 0}
      },
      "additionalProperties": false
    },
    "by_status": {
      "type": "object",
      "required": [
        "active",
        "draft",
        "testing",
        "incubating",
        "deprecated",
        "pending_confirmation"
      ],
      "properties": {
        "active": {"type": "integer", "minimum": 0},
        "draft": {"type": "integer", "minimum": 0},
        "testing": {"type": "integer", "minimum": 0},
        "incubating": {"type": "integer", "minimum": 0},
        "deprecated": {"type": "integer", "minimum": 0},
        "pending_confirmation": {"type": "integer", "minimum": 0}
      },
      "additionalProperties": false
    },
    "rules": {
      "type": "array",
      "items": {
        "type": "object",
        "required": ["rule_id", "name", "level", "scope", "status", "version", "file"],
        "properties": {
          "rule_id": {
            "type": "string",
            "pattern": "^[A-Z]+-[A-Z0-9-]+$"
          },
          "name": {"type": "string", "minLength": 1},
          "level": {
            "type": "string",
            "enum": ["L1-IRON", "L2-LOGIC", "L3-BUSINESS"]
          },
          "scope": {
            "type": "string",
            "enum": ["SINGLE_DOC", "CROSS_DOC", "CROSS_UNIT"]
          },
          "status": {
            "type": "string",
            "enum": ["draft", "testing", "active", "incubating", "deprecated", "pending_confirmation"]
          },
          "version": {
            "type": "string",
            "pattern": "^\\d+\\.\\d+\\.\\d+$"
          },
          "file": {
            "type": "string",
            "minLength": 1,
            "description": "相对 rules/ 的 JSON 文件路径，如 L2-logic/LG-001.json"
          }
        },
        "additionalProperties": true
      }
    }
  },
  "additionalProperties": true
}
