{
  "schema_version": "1.0",
  "updated_at": "2026-08-26T07:52:08+08:00",
  "total_rules": 94,
  "by_level": {
    "L1-IRON": 16,
    "L2-LOGIC": 73,
    "L3-BUSINESS": 5
  },
  "by_scope": {
    "SINGLE_DOC": 30,
    "CROSS_DOC": 46,
    "CROSS_UNIT": 18
  },
  "by_status": {
    "active": 93,
    "draft": 0,
    "testing": 0,
    "incubating": 0,
    "deprecated": 1,
    "pending_confirmation": 0
  },
  "rules": [
    {
      "rule_id": "BZ-001",
      "name": "重复值模式检测",
      "level": "L3-BUSINESS",
      "scope": "SINGLE_DOC",
      "status": "active",
      "version": "1.0.0",
      "file": "L3-business/BZ-001.json",
      "category": "数据质量-重复值",
      "source": "system"
    },
    {
      "rule_id": "BZ-002",
      "name": "突变检测",
      "level": "L3-BUSINESS",
      "scope": "SINGLE_DOC",
      "status": "active",
      "version": "1.0.0",
      "file": "L3-business/BZ-002.json",
      "category": "数据质量-突变",
      "source": "system"
    },
    {
      "rule_id": "BZ-003",
      "name": "涂改痕迹检测",
      "level": "L3-BUSINESS",
      "scope": "SINGLE_DOC",
      "status": "active",
      "version": "1.0.0",
      "file": "L3-business/BZ-003.json",
      "category": "数据质量-涂改",
      "source": "system"
    },
    {
      "rule_id": "CU-001",
      "name": "监理-施工方混凝土量偏差校验",
      "level": "L2-LOGIC",
      "scope": "CROSS_UNIT",
      "status": "active",
      "version": "1.0.0",
      "file": "L2-logic/CU-001.json",
      "category": "跨单位数量对照",
      "source": "system"
    },
    {
      "rule_id": "CU-002",
      "name": "开工令日期 ≥ 开工报审表日期",
      "level": "L2-LOGIC",
      "scope": "CROSS_UNIT",
      "status": "active",
      "version": "1.0.0",
      "file": "L2-logic/CU-002.json",
      "category": "跨单位日期对照",
      "source": "system"
    },
    {
      "rule_id": "CU-003",
      "name": "复工令日期 ≥ 复工报审表日期 ≥ 暂停令签发日期",
      "level": "L2-LOGIC",
      "scope": "CROSS_UNIT",
      "status": "active",
      "version": "1.0.0",
      "file": "L2-logic/CU-003.json",
      "category": "跨单位日期对照",
      "source": "system"
    },
    {
      "rule_id": "CU-004",
      "name": "工程延期报审：事件日期 → 申请日期 → 批准日期",
      "level": "L2-LOGIC",
      "scope": "CROSS_UNIT",
      "status": "active",
      "version": "1.0.0",
      "file": "L2-logic/CU-004.json",
      "category": "跨单位日期对照",
      "source": "system"
    },
    {
      "rule_id": "CU-005",
      "name": "费用索赔报审：事件日期 → 申请日期 → 审核日期",
      "level": "L2-LOGIC",
      "scope": "CROSS_UNIT",
      "status": "active",
      "version": "1.0.0",
      "file": "L2-logic/CU-005.json",
      "category": "跨单位日期对照",
      "source": "system"
    },
    {
      "rule_id": "CU-006",
      "name": "施工进度计划报审：编制日期 → 审查日期",
      "level": "L2-LOGIC",
      "scope": "CROSS_UNIT",
      "status": "active",
      "version": "1.0.0",
      "file": "L2-logic/CU-006.json",
      "category": "跨单位日期对照",
      "source": "system"
    },
    {
      "rule_id": "CU-007",
      "name": "工程款支付报审：申请日期 → 审核日期 → 签发日期",
      "level": "L2-LOGIC",
      "scope": "CROSS_UNIT",
      "status": "active",
      "version": "1.0.0",
      "file": "L2-logic/CU-007.json",
      "category": "跨单位日期对照",
      "source": "system"
    },
    {
      "rule_id": "CU-008",
      "name": "竣工验收申请：预验收 → 整改 → 申请",
      "level": "L2-LOGIC",
      "scope": "CROSS_UNIT",
      "status": "active",
      "version": "1.0.0",
      "file": "L2-logic/CU-008.json",
      "category": "跨单位日期对照",
      "source": "system"
    },
    {
      "rule_id": "CU-009",
      "name": "旁站记录日期 = 施工日志对应工序日期",
      "level": "L2-LOGIC",
      "scope": "CROSS_UNIT",
      "status": "active",
      "version": "1.0.0",
      "file": "L2-logic/CU-009.json",
      "category": "跨单位日期对照",
      "source": "system"
    },
    {
      "rule_id": "CU-010",
      "name": "旁站通知提前量：施工日期 - 通知日期 ≥ 12小时",
      "level": "L2-LOGIC",
      "scope": "CROSS_UNIT",
      "status": "active",
      "version": "1.0.0",
      "file": "L2-logic/CU-010.json",
      "category": "跨单位日期对照",
      "source": "system"
    },
    {
      "rule_id": "CU-011",
      "name": "巡视记录日期连续性 vs 施工日志",
      "level": "L2-LOGIC",
      "scope": "CROSS_UNIT",
      "status": "active",
      "version": "1.0.0",
      "file": "L2-logic/CU-011.json",
      "category": "跨单位日期对照",
      "source": "system"
    },
    {
      "rule_id": "CU-012",
      "name": "工序/检验批验收：施工自检日期 ≤ 监理验收日期",
      "level": "L2-LOGIC",
      "scope": "CROSS_UNIT",
      "status": "active",
      "version": "1.0.0",
      "file": "L2-logic/CU-012.json",
      "category": "跨单位日期对照",
      "source": "system"
    },
    {
      "rule_id": "CU-013",
      "name": "工程试验段：施工 → 记录 → 总结审批",
      "level": "L2-LOGIC",
      "scope": "CROSS_UNIT",
      "status": "active",
      "version": "1.0.0",
      "file": "L2-logic/CU-013.json",
      "category": "跨单位日期对照",
      "source": "system"
    },
    {
      "rule_id": "CU-014",
      "name": "危大工程：方案审查 → 专家论证 → 验收",
      "level": "L2-LOGIC",
      "scope": "CROSS_UNIT",
      "status": "active",
      "version": "1.0.0",
      "file": "L2-logic/CU-014.json",
      "category": "跨单位日期对照",
      "source": "system"
    },
    {
      "rule_id": "CU-015",
      "name": "施工检测报告：取样 ≤ 检测 ≤ 报告 ≤ 验收",
      "level": "L2-LOGIC",
      "scope": "CROSS_UNIT",
      "status": "active",
      "version": "1.0.0",
      "file": "L2-logic/CU-015.json",
      "category": "跨单位日期对照",
      "source": "system"
    },
    {
      "rule_id": "CU-016",
      "name": "平行检测报告 vs 施工检测报告日期比对",
      "level": "L2-LOGIC",
      "scope": "CROSS_UNIT",
      "status": "active",
      "version": "1.0.0",
      "file": "L2-logic/CU-016.json",
      "category": "跨单位日期对照",
      "source": "system"
    },
    {
      "rule_id": "CU-017",
      "name": "第一次工地会议纪要日期 ≤ 开工日期",
      "level": "L2-LOGIC",
      "scope": "CROSS_UNIT",
      "status": "active",
      "version": "1.0.0",
      "file": "L2-logic/CU-017.json",
      "category": "跨单位日期对照",
      "source": "system"
    },
    {
      "rule_id": "CU-018",
      "name": "监理例会/专题会议：会议日期 vs 议定事项时限",
      "level": "L2-LOGIC",
      "scope": "CROSS_UNIT",
      "status": "active",
      "version": "1.0.0",
      "file": "L2-logic/CU-018.json",
      "category": "跨单位日期对照",
      "source": "system"
    },
    {
      "rule_id": "IR-001",
      "name": "规范可追溯",
      "level": "L1-IRON",
      "scope": "SINGLE_DOC",
      "status": "active",
      "version": "1.0.0",
      "file": "L1-iron/IR-001.json",
      "category": "合规底线",
      "source": "system"
    },
    {
      "rule_id": "IR-002",
      "name": "OCR 必复核",
      "level": "L1-IRON",
      "scope": "SINGLE_DOC",
      "status": "active",
      "version": "1.0.0",
      "file": "L1-iron/IR-002.json",
      "category": "数据校验",
      "source": "system"
    },
    {
      "rule_id": "IR-003",
      "name": "运算只审规",
      "level": "L1-IRON",
      "scope": "SINGLE_DOC",
      "status": "active",
      "version": "1.0.0",
      "file": "L1-iron/IR-003.json",
      "category": "合规底线",
      "source": "system"
    },
    {
      "rule_id": "IR-004",
      "name": "结论有据",
      "level": "L1-IRON",
      "scope": "SINGLE_DOC",
      "status": "active",
      "version": "1.0.0",
      "file": "L1-iron/IR-004.json",
      "category": "合规底线",
      "source": "system"
    },
    {
      "rule_id": "IR-005",
      "name": "标准是归档",
      "level": "L1-IRON",
      "scope": "SINGLE_DOC",
      "status": "active",
      "version": "1.0.0",
      "file": "L1-iron/IR-005.json",
      "category": "合规底线",
      "source": "system"
    },
    {
      "rule_id": "IR-006",
      "name": "拒为伪证背书",
      "level": "L1-IRON",
      "scope": "SINGLE_DOC",
      "status": "active",
      "version": "1.0.0",
      "file": "L1-iron/IR-006.json",
      "category": "伦理红线",
      "source": "system"
    },
    {
      "rule_id": "IR-007",
      "name": "留痕",
      "level": "L1-IRON",
      "scope": "SINGLE_DOC",
      "status": "active",
      "version": "1.0.0",
      "file": "L1-iron/IR-007.json",
      "category": "合规底线",
      "source": "system"
    },
    {
      "rule_id": "IR-008",
      "name": "阴≠阳",
      "level": "L1-IRON",
      "scope": "SINGLE_DOC",
      "status": "active",
      "version": "1.0.0",
      "file": "L1-iron/IR-008.json",
      "category": "合规底线",
      "source": "system"
    },
    {
      "rule_id": "IR-010",
      "name": "数据质量前置",
      "level": "L1-IRON",
      "scope": "SINGLE_DOC",
      "status": "active",
      "version": "1.0.0",
      "file": "L1-iron/IR-010.json",
      "category": "数据校验",
      "source": "system"
    },
    {
      "rule_id": "IR-011",
      "name": "全列提取",
      "level": "L1-IRON",
      "scope": "SINGLE_DOC",
      "status": "active",
      "version": "1.0.0",
      "file": "L1-iron/IR-011.json",
      "category": "数据校验",
      "source": "system"
    },
    {
      "rule_id": "IR-015",
      "name": "原始底稿追溯",
      "level": "L1-IRON",
      "scope": "CROSS_DOC",
      "status": "active",
      "version": "1.0.0",
      "file": "L1-iron/IR-015.json",
      "category": "数据校验",
      "source": "system"
    },
    {
      "rule_id": "IR-016",
      "name": "提取-验证-重试",
      "level": "L1-IRON",
      "scope": "SINGLE_DOC",
      "status": "active",
      "version": "1.0.0",
      "file": "L1-iron/IR-016.json",
      "category": "数据校验",
      "source": "system"
    },
    {
      "rule_id": "IR-017",
      "name": "合计值反向验证",
      "level": "L1-IRON",
      "scope": "CROSS_DOC",
      "status": "active",
      "version": "1.0.0",
      "file": "L1-iron/IR-017.json",
      "category": "数据校验",
      "source": "system"
    },
    {
      "rule_id": "IR-018",
      "name": "置信度分级",
      "level": "L1-IRON",
      "scope": "SINGLE_DOC",
      "status": "active",
      "version": "1.0.0",
      "file": "L1-iron/IR-018.json",
      "category": "合规底线",
      "source": "system"
    },
    {
      "rule_id": "IR-019",
      "name": "用户标记闭环",
      "level": "L1-IRON",
      "scope": "SINGLE_DOC",